{
  "$schema": "https://design.ramoslabs.com/schema/contract.v1.json",
  "name": "SJSwitch",
  "contractVersion": "0.1.0",
  "status": "beta",
  "pattern": { "apg": "switch", "evidence": "switch", "native": "checkbox" },
  "anatomy": [
    { "part": "root", "element": "label" },
    {
      "part": "control",
      "element": "input",
      "role": "switch",
      "native": true,
      "attributes": { "type": "checkbox" }
    },
    { "part": "thumb", "element": "span" },
    { "part": "label", "element": "span" }
  ],
  "state": { "machine": ["off", "on"], "controllable": ["checked"] },
  "actions": [
    {
      "id": "toggle",
      "from": "off",
      "to": "on",
      "emit": "checkedChange",
      "dom": { "control": { "checked": "true" } }
    },
    {
      "id": "toggle",
      "from": "on",
      "to": "off",
      "emit": "checkedChange",
      "dom": { "control": { "checked": "false" } }
    }
  ],
  "keyboard": { "control": { "Space": "toggle" } },
  "focus": { "strategy": "native", "owner": "control" },
  "kinds": [],
  "runtime": ["idPrefix"],
  "support": [],
  "a11y": {
    "wcag": ["1.4.11", "2.1.1", "2.4.7", "2.4.11", "2.5.8", "4.1.2"],
    "liveRegions": [],
    "atAssertions": ["manual-speech-name-role-state", "manual-toggle-space"],
    "atSupport": [
      {
        "at": "voiceover",
        "platform": "macos",
        "browser": "safari",
        "test_status": "pending-real-test",
        "evidence": ["at-support/switch.json#vo-macos-safari-ariaat561"]
      },
      {
        "at": "voiceover",
        "platform": "ios",
        "browser": "safari",
        "test_status": "pending-real-test",
        "evidence": ["at-support/switch.json#vo-ios-safari-apg-switch"]
      },
      {
        "at": "nvda",
        "platform": "windows",
        "browser": "chrome",
        "test_status": "evidence-only",
        "evidence": ["at-support/switch.json#nvda-chrome-ariaat562"]
      },
      {
        "at": "jaws",
        "platform": "windows",
        "browser": "chrome",
        "test_status": "evidence-only",
        "evidence": ["at-support/switch.json#jaws-chrome-ariaat563"]
      },
      {
        "at": "talkback",
        "platform": "android",
        "browser": "chrome",
        "test_status": "evidence-only",
        "evidence": ["at-support/switch.json#talkback-chrome-apg-switch"]
      }
    ]
  },
  "events": [{ "name": "checkedChange", "payload": "{ checked: boolean }" }],
  "props": [
    { "name": "checked", "type": "boolean" },
    { "name": "defaultChecked", "type": "boolean", "default": false },
    { "name": "disabled", "type": "boolean", "default": false },
    { "name": "name", "type": "string" },
    { "name": "value", "type": "string", "default": "on" },
    { "name": "id", "type": "string" }
  ],
  "slots": [{ "name": "default", "description": "Visible label; must not change with state." }],
  "fixtures": ["off", "on", "disabled", "long-label"],
  "budgets": { "gzipKiB": 1, "shared": [] }
}
